{
  "hash_alg": "sha256",
  "manifest_sha256": "5555555555555555555555555555555555555555555555555555555555555555",
  "pack_sha256": "6666666666666666666666666666666666666666666666666666666666666666",
  "signed_by": {
    "key_id": "org-signing-key-1",
    "alg": "ed25519",
    "signature_base64": "<base64sig>"
  }
}